{
  "grades": "Grades 9 to 12",
  "max_age": null,
  "apply_url": null,
  "verified": "fetched",
  "verified_on": "2026-10-09",
  "needs_work_permit": false,
  "priority": 3,
  "notes": "Price for Tier 2 and Tier 3 was not checked. Email precollege@ucsd.edu with questions.",
  "id": "san-diego-ucsd-marine-science-research-scholars",
  "name": "UC San Diego Marine Science Research Scholars",
  "org": "UC San Diego Division of Extended Studies (with Scripps Institution of Oceanography mentors)",
  "regions": [
    "san-diego"
  ],
  "city": "La Jolla, San Diego, CA (live online)",
  "type": "pre-college",
  "fields": [
    "science",
    "environment"
  ],
  "what_you_do": "Take live online ocean science courses in three levels. Level 1 teaches marine biology. Level 2 is hands-on research with Scripps graduate students. Level 3 builds science writing and a chance to publish.",
  "min_age": 14,
  "who_can_apply": "Students in grades 9 to 12 who are at least 14 when the program starts. You finish one Tier 1 course before applying for Tier 2.",
  "paid_type": "fee-based",
  "pay_detail": "Fall 2026 Tier 1 course cost $2,000 in tuition. Scholarships were listed but closed.",
  "season": "winter",
  "duration": "About 7 weeks per course (Fall 2026 Tier 1 ran Sept 22 to Nov 12)",
  "status": "closed-expect-reopen",
  "deadline_text": "Winter 2027 applications are listed as coming soon. The Fall 2026 deadline (Sept 17, 2026) has passed.",
  "deadline_iso": null,
  "deadline_confidence": "last-year-pattern",
  "how_to_apply": "Apply online when a term opens. Students are accepted on a rolling basis and pay within 2 weeks of acceptance.",
  "url": "https://researchscholars.ucsd.edu/currentprograms/marinescience/index.html",
  "sources_fetched": [
    "https://researchscholars.ucsd.edu/currentprograms/marinescience/index.html",
    "https://researchscholars.ucsd.edu/currentprograms/marinescience/tier1-courses-drawer.html",
    "https://researchscholars.ucsd.edu/scholarships/index.html"
  ]
}
