{
  "id": "madison-college-career-discovery-youth-camps",
  "grades": null,
  "min_age": null,
  "max_age": null,
  "apply_url": null,
  "verified": "fetched",
  "verified_on": "2026-10-09",
  "needs_work_permit": null,
  "priority": 2,
  "deadline_iso": null,
  "pay_detail": "Cost is listed for each camp. Lunch and snacks are included. A limited number of scholarships are available.",
  "duration": "Camps run 9 am to 3 pm; length varies by camp",
  "name": "Career Discovery Youth Camps at Madison College",
  "org": "Madison College, Professional and Continuing Education",
  "regions": [
    "madison"
  ],
  "city": "Madison, WI",
  "type": "pre-college",
  "fields": [
    "trades",
    "health",
    "engineering",
    "food-hospitality"
  ],
  "what_you_do": "Day camps from 9 am to 3 pm on trades, health, engineering, culinary and arts topics, with field trips. Students try hands-on career skills at the college.",
  "who_can_apply": "Students in grades 3 to 12. Each camp lists its own grades, based on grade level in fall 2027.",
  "paid_type": "fee-based",
  "season": "summer",
  "status": "opens-soon",
  "opens_iso": "2027-02-28",
  "deadline_text": "Summer 2027 camp registration opens February 28, 2027 at 8:00 AM. Camps are posted in January.",
  "deadline_confidence": "confirmed-2026-27",
  "how_to_apply": "Add the camp to the cart on the registration site and enter the student information. Look for the scholarship form on the page.",
  "url": "https://madisoncollege.edu/academics/youth-programs/madison-camps",
  "sources_fetched": [
    "https://madisoncollege.edu/academics/youth-programs/madison-camps",
    "https://madisoncollege.edu/academics/youth-programs"
  ],
  "notes": "The camps on this page are at the Madison campuses. The college lists camps at Fort Atkinson, Portage, Reedsburg and Watertown on a separate page."
}
