{
  "regions": [
    "orange-county"
  ],
  "apply_url": null,
  "verified": "fetched",
  "verified_on": "2026-10-14",
  "grades": null,
  "needs_work_permit": false,
  "id": "ocsd-explorer-program",
  "name": "Orange County Sheriff Explorer Program",
  "org": "Orange County Sheriff's Department",
  "city": "Orange County, CA",
  "type": "volunteer",
  "fields": [
    "law-government",
    "social-impact"
  ],
  "what_you_do": "Learn about police work. Help the Sheriff's Department at parades, health fairs and charity events. Explorers are volunteers. They are not police staff.",
  "min_age": 14,
  "max_age": 21,
  "who_can_apply": "Ages 14 to 21. You must keep a 2.0 GPA or higher and be in good standing with school administrators. You cannot have arrests or convictions and cannot be on probation. You cannot have a severe mental or physical limit.",
  "paid_type": "unpaid",
  "pay_detail": "Unpaid. Explorers are volunteers.",
  "season": "year-round",
  "duration": "Not stated on the program page",
  "status": "unconfirmed",
  "deadline_text": "No dates are posted. Use the Explorer Interest Form on the program page.",
  "deadline_iso": null,
  "deadline_confidence": "unknown",
  "how_to_apply": "Fill out the Explorer Interest Form on the program page. Or call 714-566-2711 to learn more.",
  "url": "https://www.ocsheriff.gov/explorer",
  "priority": 2,
  "notes": "The first police Explorer post in the US began in Santa Ana in 1959. The Sheriff also runs a Teen Academy for ages 16 to 18.",
  "sources_fetched": [
    "https://www.ocsheriff.gov/explorer"
  ]
}
