{
  "id": "philadelphia-police-explorer-cadets-post-991",
  "grades": null,
  "apply_url": null,
  "deadline_iso": null,
  "verified": "fetched",
  "verified_on": "2026-10-09",
  "priority": 2,
  "min_age": 14,
  "max_age": 20,
  "name": "Police Explorer Cadet Program (Post 991)",
  "org": "Philadelphia Police Department, with Learning for Life",
  "regions": [
    "philadelphia"
  ],
  "city": "Philadelphia, PA",
  "type": "civic-government",
  "fields": [
    "law-government"
  ],
  "what_you_do": "Learn about police work. You get mentoring, classroom lessons and hands-on drills. You meet every Saturday at the Police Academy. Cadets also help at parades, runs and city events.",
  "who_can_apply": "Ages 14 to 20 who want a law enforcement career. 14 year olds must be in high school. Under 18 needs a parent or guardian consent. Needs a passing behavior grade, good health for running and agility drills, and no arrests or convictions that would block a future police job.",
  "paid_type": "not-stated",
  "pay_detail": "Pay, stipend or fees are not stated on the program pages.",
  "season": "year-round",
  "duration": "Every Saturday 10 am to 5 pm at the Philadelphia Police Academy, plus optional summer camps and a Washington DC trip.",
  "status": "open-now",
  "deadline_text": "The program site says applications are open for 2026-2027. No closing date is posted.",
  "deadline_confidence": "confirmed-2026-27",
  "how_to_apply": "Use the online intake form on the program site. It is on the Apply and Forms page. If you are under 18, get a parent or guardian to say yes.",
  "needs_work_permit": null,
  "url": "https://www.ppdexplorers.org/",
  "sources_fetched": [
    "https://www.phillypolice.com/community-services/youth-programs/police-explorer-cadet-program/",
    "https://www.ppdexplorers.org/"
  ],
  "notes": "Most cadets are not paid, but the pages do not say. Cadets who want to be police officers are urged to join the police recruit testing later. Other Explorer camps include a Pennsylvania State Police week and a camp at Fort Indiantown Gap. The program site lists a $50 a year fee for insurance and registration, collected if you are accepted. It also lists about $350 for probation uniforms."
}
