{
  "id": "djusd-internship-career-course",
  "name": "Internship and Career Development Course",
  "org": "Davis Joint Unified School District (CTE)",
  "regions": [
    "davis",
    "yolo"
  ],
  "city": "Davis, CA",
  "type": "school-pathway",
  "fields": [
    "any",
    "health",
    "education",
    "engineering",
    "law-government",
    "arts-media"
  ],
  "what_you_do": "You take a school course with weekly coaching on resumes, cover letters and interviews. You get an unpaid internship or prep for paid work. Sites include Davis Public Library, Davis Vanguard, Mercy General and Pemberton Engineering.",
  "min_age": null,
  "max_age": null,
  "grades": "high school (DJUSD students)",
  "who_can_apply": "Davis Joint Unified high school students. Some sites have priority rules (Dignity Health for Patient Care pathway students; Ford ACE for Transportation pathway students).",
  "paid_type": "unpaid-credit",
  "pay_detail": "Unpaid internships; course credit with evaluation and reflection required.",
  "season": "school-year",
  "duration": null,
  "status": "year-round",
  "opens_iso": null,
  "deadline_text": "No deadline posted. 2026-27 sites are listed now.",
  "deadline_iso": null,
  "deadline_confidence": "unknown",
  "how_to_apply": "Talk to your counselor or contact Internship Specialist Alexha Contreras (alcontreras@djusd.net, 530-757-5400 x170).",
  "needs_work_permit": false,
  "url": "https://www.djusd.net/instruction/programs/CTE/student_c_t_e_opportunities",
  "apply_url": null,
  "sources_fetched": [
    "https://www.djusd.net/instruction/programs/CTE/student_c_t_e_opportunities"
  ],
  "verified": "fetched",
  "verified_on": "2026-10-07",
  "priority": 1,
  "notes": "Many other 2026-27 host sites are listed on the page; some have priority rules (Mercy General: Patient Care pathway students; Ford ACE: Transportation pathway students). Credit needs weekly meetings, an evaluation and a reflection. The page is written for DJUSD students."
}
