{
  "id": "santa-clara-students-of-service",
  "name": "Students of Service (SOS) teen volunteer program",
  "org": "City of Santa Clara Parks & Recreation",
  "regions": [
    "silicon-valley"
  ],
  "city": "Santa Clara, CA",
  "type": "volunteer",
  "fields": [
    "social-impact",
    "education"
  ],
  "what_you_do": "Sign up once and get emails about volunteer jobs at city events, the Youth & Teen Center, the community garden, theater shows and Magical Bridge Playground. You pick the ones you want and earn service hours.",
  "min_age": 13,
  "max_age": 18,
  "grades": null,
  "who_can_apply": "High school students ages 13 to 18 who live in the City of Santa Clara or go to a Santa Clara Unified school.",
  "paid_type": "unpaid",
  "pay_detail": null,
  "season": "year-round",
  "duration": "Ongoing. You choose single shifts and events through the year.",
  "status": "rolling",
  "opens_iso": null,
  "deadline_text": "Open now. The 2026 Fall sign-up runs Aug 1, 2026 to Jul 31, 2028 and still takes registrations. No closing date.",
  "deadline_iso": null,
  "deadline_confidence": "rolling",
  "how_to_apply": "Register for Students of Service on the city's ActiveNet sign-up page (free). The city then emails you volunteer openings. Kindness Ambassador shifts at Magical Bridge Playground need a short training first (about 40 minutes, in person or on Zoom). Questions: Youth & Teen Center, 408-615-3760, ytc@santaclaraca.gov.",
  "needs_work_permit": false,
  "url": "https://www.santaclaraca.gov/our-city/departments-g-z/parks-recreation/recreation-programs/community-service",
  "apply_url": "https://anc.apm.activecommunities.com/santaclara/activity/search/detail/23679?onlineSiteId=0&from_original_cui=true",
  "sources_fetched": [
    "https://www.santaclaraca.gov/our-city/departments-g-z/parks-recreation/recreation-programs/community-service",
    "https://anc.apm.activecommunities.com/santaclara/activity/search/detail/23679?onlineSiteId=0&from_original_cui=true"
  ],
  "verified": "fetched",
  "verified_on": "2026-10-16",
  "priority": 1,
  "notes": "Registration is free. The training for Kindness Ambassador shifts counts toward your hours. The same page lists a Summer Junior Leader program (ages 14-18) for camps and swim programs, but it charges a fee and summer 2026 is closed."
}
