{
  "id": "nc-governors-school",
  "name": "North Carolina Governor's School",
  "org": "NC Department of Public Instruction",
  "regions": [
    "north-carolina"
  ],
  "city": "Raleigh and Greensboro, NC (Meredith College and Greensboro College)",
  "type": "pre-college",
  "fields": [
    "science",
    "arts-media",
    "education"
  ],
  "what_you_do": "Live on a college campus for four weeks and study one subject in depth: English, math, natural science, social science, Spanish, or an arts area. There are no grades or tests.",
  "min_age": null,
  "max_age": null,
  "grades": "11 when nominated (grades 10 and 11 for dance, choral music and instrumental music)",
  "who_can_apply": "North Carolina residents in public or non-public schools. You must meet one of the GPA or course rules in the family overview, for example a 3.25 unweighted GPA. You cannot apply on your own. Your school or district must nominate you first.",
  "paid_type": "fee-based",
  "pay_detail": "$600 tuition per student, collected through the school or district. Need-based scholarships are offered by the NC Governor's School Foundation. Families pay for travel.",
  "season": "summer",
  "duration": "Four weeks (June 20 to July 17, 2027)",
  "status": "open-now",
  "opens_iso": null,
  "deadline_text": "Application forms were released in Sept 2026. Local school deadlines vary and come in fall 2026. Selection news goes out in early to mid March 2027.",
  "deadline_iso": null,
  "deadline_confidence": "unknown",
  "how_to_apply": "Talk to your school counselor or local Governor's School coordinator. Turn in the student application at your school, not to the state office. It has one essay or audition and a personal readiness form. Turn in two recommendation forms too.",
  "needs_work_permit": false,
  "url": "https://www.dpi.nc.gov/students-families/enhanced-opportunities/north-carolina-governors-school",
  "apply_url": "https://www.dpi.nc.gov/students-families/enhanced-opportunities/north-carolina-governors-school/application-and-selection-process",
  "sources_fetched": [
    "https://www.dpi.nc.gov/students-families/enhanced-opportunities/north-carolina-governors-school",
    "https://www.dpi.nc.gov/students-families/enhanced-opportunities/north-carolina-governors-school/application-and-selection-process",
    "https://docs.google.com/document/d/1paB-3K79SNjRSHPFjQmtUl8ddSsvKS9vwGhMjXzplJ0/edit?usp=sharing"
  ],
  "verified": "fetched",
  "verified_on": "2026-10-09",
  "priority": 2,
  "notes": "Competitive. The family overview says about 1,800 students are nominated and about 800 are picked in a typical year. Students must stay the whole session and may attend only once. The overview says you may not use AI on the application."
}
