{
  "grades": "Completed junior year (rising senior)",
  "min_age": null,
  "max_age": null,
  "opens_iso": null,
  "deadline_iso": null,
  "apply_url": null,
  "verified": "fetched",
  "verified_on": "2026-10-09",
  "id": "new-jersey-governors-school-engineering-technology",
  "name": "Governor's School of New Jersey in Engineering and Technology",
  "org": "Rutgers School of Engineering / State of New Jersey",
  "regions": [
    "new-brunswick",
    "new-jersey"
  ],
  "city": "Piscataway, NJ",
  "type": "pre-college",
  "fields": [
    "engineering",
    "tech-cs",
    "science"
  ],
  "what_you_do": "This is a free, four-week residential summer program for rising seniors. You take four courses. You do a small team research and design project. You visit companies. A final research symposium ends the program.",
  "who_can_apply": "New Jersey residents who have finished their junior year at a public, private or home school. Applicants must be nominated by their high school (one nominee per 325 juniors). It is competitive. Fewer than 25% of nominees get offers.",
  "paid_type": "unpaid",
  "pay_detail": "Free to students and families (tuition, room and board paid by donations). FAQ says students bring a $65 key deposit returned at the end. The FAQ page is undated.",
  "season": "summer",
  "duration": "About 4 weeks, starting close to the beginning of July, with about 40 hours of prep work beforehand",
  "status": "closed-expect-reopen",
  "deadline_text": "2027 application not posted on the pages read. The state page (updated 11/13/25) said 2026 applications were open; decisions are emailed in early April. Ask your school counselor about the school nomination deadline.",
  "deadline_confidence": "unknown",
  "how_to_apply": "Get nominated by your high school, then submit the online application with essays (admission is based heavily on essays). Contact: njgset@soe.rutgers.edu or 848-445-4753.",
  "needs_work_permit": false,
  "url": "https://gset.rutgers.edu/",
  "priority": 2,
  "notes": "Residential at Rutgers School of Engineering, 98 Brett Road, Piscataway. The Application Instructions page on the program site still mentions the Summer 2023 application, so rely on the state page and director for 2027 dates.",
  "sources_fetched": [
    "https://gset.rutgers.edu/",
    "https://gset.rutgers.edu/node/16",
    "https://gset.rutgers.edu/node/15",
    "https://www.nj.gov/govschool/"
  ]
}
