{
  "grades": null,
  "max_age": 22,
  "min_age": 14,
  "opens_iso": null,
  "deadline_iso": null,
  "apply_url": null,
  "needs_work_permit": null,
  "verified": "fetched",
  "verified_on": "2026-10-10",
  "priority": 2,
  "notes": "Ages and hours come from the first (2024) cohort. Confirm the 2027 rules.",
  "deadline_confidence": "unknown",
  "fields": [
    "arts-media",
    "social-impact"
  ],
  "id": "albuquerque-working-classroom-youth-arts-leadership",
  "name": "Youth Arts Leadership (YAL)",
  "org": "Working Classroom",
  "regions": [
    "new-mexico"
  ],
  "city": "Albuquerque, NM",
  "type": "paid-youth-program",
  "what_you_do": "Young artists get paid work in the arts. They also grow personal and work skills and learn to organize their culture, through art projects, community work, service learning and goal setting.",
  "who_can_apply": "The 2024 cohort was youth ages 14 to 22. Rules for 2027 are not posted yet.",
  "paid_type": "paid",
  "pay_detail": "Paid. Amount not stated.",
  "season": "school-year",
  "duration": "2024 cohort: 300 hours over 8 months",
  "status": "unconfirmed",
  "deadline_text": "Page says more information about the 2027 program is coming soon. Email programs@workingclassroom.org to get on the notification list.",
  "how_to_apply": "Email programs@workingclassroom.org to get on the list for the 2027 program.",
  "url": "https://workingclassroom.org/youth-arts-leadership",
  "sources_fetched": [
    "https://workingclassroom.org/youth-arts-leadership"
  ]
}
