{
  "grades": "9 to 12",
  "opens_iso": null,
  "deadline_iso": null,
  "apply_url": null,
  "verified": "fetched",
  "verified_on": "2026-10-09",
  "priority": 2,
  "needs_work_permit": false,
  "notes": "Earns service-learning hours at restoration events. Ask CBF about cost and scholarships for expeditions.",
  "id": "maryland-cbf-student-leadership-program",
  "name": "Student Leadership Program",
  "org": "Chesapeake Bay Foundation",
  "regions": [
    "maryland"
  ],
  "city": "Maryland (Chesapeake Bay watershed, includes Baltimore and DC area)",
  "type": "leadership",
  "fields": [
    "environment",
    "social-impact"
  ],
  "what_you_do": "Learn about Bay issues outdoors, join restoration events, meet decision makers, and plan an action project for your community. Summer Expeditions are multi-day overnight trips.",
  "min_age": null,
  "max_age": null,
  "who_can_apply": "High school students living in the Chesapeake Bay watershed (Maryland, Pennsylvania, Virginia, Washington DC). Summer Expeditions are for rising 9th to 12th graders. No past experience needed.",
  "paid_type": "not-stated",
  "pay_detail": "Not stated. Costs for Summer Expeditions are not on this page.",
  "season": "year-round",
  "duration": "Year-round program. Summer Expeditions last several days.",
  "status": "unconfirmed",
  "deadline_text": "Summer Expedition registration begins each year in early January.",
  "deadline_confidence": "last-year-pattern",
  "how_to_apply": "Use the contact form on the CBF page or call 410-268-8816. Registration for Summer Expeditions opens in early January.",
  "url": "https://www.cbf.org/programs/student-leadership",
  "sources_fetched": [
    "https://www.cbf.org/programs/student-leadership"
  ]
}
