{
  "id": "portland-pnca-pre-college-summer",
  "grades": null,
  "opens_iso": null,
  "deadline_iso": "2027-05-02",
  "apply_url": null,
  "verified": "fetched",
  "verified_on": "2026-10-10",
  "priority": 2,
  "needs_work_permit": false,
  "name": "PNCA Pre-College summer art and design programs",
  "org": "Pacific Northwest College of Art (PNCA) at Willamette University, Community Education",
  "city": "Portland, OR",
  "type": "pre-college",
  "fields": [
    "arts-media"
  ],
  "what_you_do": "2 week Intensives and 1 week Studios. You draw, paint, animate and illustrate with PNCA teachers and artists. You build portfolio work. You meet admissions staff for a portfolio review.",
  "min_age": 14,
  "max_age": 18,
  "who_can_apply": "Students ages 14 to 18 who have finished at least one year of high school.",
  "paid_type": "fee-based",
  "pay_detail": "Tuition (includes materials) for Summer 2027 will be announced when applications open this fall. Need-based scholarships and payment plans are available; early registration saves 10%.",
  "season": "summer",
  "duration": "Intensives are 2 weeks and Studios are 1 week, 9 am to 4:30 pm Monday to Friday. 2027 sessions run July 12 to Aug 6.",
  "status": "closed-expect-reopen",
  "deadline_text": "Applications open fall 2026. 2027 dates: early application Mar 28, early registration Apr 11, application deadline May 2, registration deadline June 6 (rolling until full).",
  "deadline_confidence": "confirmed-2026-27",
  "how_to_apply": "Apply online on a rolling basis until programs are full. Applications open fall 2026, per the page.",
  "url": "https://pnca.willamette.edu/academics/pre-college-programs.html",
  "notes": "The page does not list dollar amounts for tuition or scholarships.",
  "regions": [
    "oregon"
  ],
  "sources_fetched": [
    "https://pnca.willamette.edu/academics/pre-college-programs.html"
  ]
}
