{
  "id": "nasa-genelab-for-high-schools",
  "name": "NASA GeneLab for High Schools (GL4HS)",
  "org": "NASA Ames Research Center",
  "regions": [
    "silicon-valley",
    "virtual",
    "national"
  ],
  "city": "Virtual (hosted by NASA Ames, Mountain View, CA)",
  "type": "research",
  "fields": [
    "science",
    "tech-cs",
    "health"
  ],
  "what_you_do": "A 12-week online, self-paced program on space biology, bioinformatics and computational biology, about 20 hours a week.",
  "min_age": null,
  "max_age": null,
  "grades": "Rising juniors and seniors (and college freshmen)",
  "who_can_apply": "U.S. citizens or permanent residents attending a U.S.-based high school; rising juniors, seniors, or college freshmen; unweighted GPA of 3.0 or higher; at least one high school biology course; a computer with stable internet.",
  "paid_type": "unpaid",
  "pay_detail": "Free. No stipends since 2026.",
  "season": "summer",
  "duration": "12 weeks, June 1 to Aug 28 in 2026",
  "status": "closed-expect-reopen",
  "opens_iso": null,
  "deadline_text": "2026 applications ran Feb 15 to Mar 15, 2026, or until 1,000 applicants. 2027 dates not posted.",
  "deadline_iso": null,
  "deadline_confidence": "last-year-pattern",
  "how_to_apply": "Apply online with a PDF high school transcript when the window opens.",
  "needs_work_permit": false,
  "url": "https://www.nasa.gov/ames/genelab-for-high-schools/",
  "apply_url": "https://www.nasa.gov/ames/space-biosciences/genelab-for-high-schools-application-instructions",
  "sources_fetched": [
    "https://www.nasa.gov/ames/genelab-for-high-schools/"
  ],
  "verified": "fetched",
  "verified_on": "2026-10-07",
  "priority": 1,
  "notes": "The real NASA Ames option for high schoolers. NASA's main OSTEM internships are college-only. Acceptance was rolling through April 30, 2026, and the cap was 1,000 applications, so apply early. Needs a PDF high school transcript. No 2027 dates posted."
}
