{
  "id": "denver-parks-recreation-youth-meals-recreation-volunteer",
  "name": "Denver Parks and Recreation Volunteers: Free Youth Meals and Recreation",
  "org": "Denver Parks and Recreation",
  "regions": [
    "colorado"
  ],
  "city": "Denver, CO",
  "type": "volunteer",
  "fields": [
    "social-impact",
    "food-hospitality"
  ],
  "what_you_do": "Help recreation center staff serve free meals to kids and teens. Meals can be breakfast, lunch, snacks or supper. You can also help with games and other activities.",
  "min_age": 15,
  "max_age": null,
  "grades": null,
  "who_can_apply": "For the free youth meals volunteer job, you must be at least 15 years old, finish an application and pass a background check.",
  "paid_type": "unpaid",
  "pay_detail": "Unpaid",
  "season": "year-round",
  "duration": "Not stated on the program page",
  "status": "rolling",
  "opens_iso": null,
  "deadline_text": "No deadline stated on the program page.",
  "deadline_iso": null,
  "deadline_confidence": "rolling",
  "how_to_apply": "Email andrea.garcia@denvergov.org to start. Send the online application and any documents you need through Engage Denver. Send questions to Volunteers.Recreation@denvergov.org.",
  "needs_work_permit": false,
  "url": "https://www.denvergov.org/Government/Agencies-Departments-Offices/Agencies-Departments-Offices-Directory/Parks-Recreation/Get-Involved-with-Denver-Parks-Recreation/Volunteer-with-Denver-Parks-Recreation",
  "apply_url": null,
  "sources_fetched": [
    "https://www.denvergov.org/Government/Agencies-Departments-Offices/Agencies-Departments-Offices-Directory/Parks-Recreation/Get-Involved-with-Denver-Parks-Recreation/Volunteer-with-Denver-Parks-Recreation"
  ],
  "verified": "fetched",
  "verified_on": "2026-10-13",
  "priority": 2,
  "notes": "The page says all volunteers must be at least 15, finish an application and pass a background check. It also lists other jobs, like park clean-ups and mountain park projects. It gives no age rule for those."
}
