{
  "grades": "Rising grades 9 to 12",
  "opens_iso": null,
  "deadline_iso": null,
  "apply_url": null,
  "needs_work_permit": null,
  "verified": "fetched",
  "verified_on": "2026-10-09",
  "priority": 2,
  "notes": "Cost was not stated on the pages. Ask about the scholarship page before you decide.",
  "id": "michigan-detroit-wayne-state-engineering-summer-academy-high-school",
  "name": "Summer Academy high school camps",
  "org": "Wayne State University, Anderson College of Engineering",
  "regions": [
    "michigan"
  ],
  "city": "Detroit, MI",
  "type": "pre-college",
  "fields": [
    "engineering",
    "tech-cs"
  ],
  "what_you_do": "Spend a week on campus on real projects in coding, design, construction and game development. Special camps cover construction management, smart agriculture and aviation careers.",
  "min_age": null,
  "max_age": null,
  "who_can_apply": "Students going into grades 9 to 12. Choose camp I or II of a topic, not both.",
  "paid_type": "fee-based",
  "pay_detail": "Price not on the program pages. A scholarships page is listed.",
  "season": "summer",
  "duration": "1 week per camp. You can mix topics across weeks.",
  "status": "closed-expect-reopen",
  "deadline_text": "The page says all summer 2026 sessions are complete. 2027 dates not posted.",
  "deadline_confidence": "last-year-pattern",
  "how_to_apply": "Register through the Summer Academy pages. Use the question link to reach the Director of Community Engagement.",
  "url": "https://engineering.wayne.edu/academics/community/outreach/engineering-highschool-summer-camps",
  "sources_fetched": [
    "https://engineering.wayne.edu/academics/community/outreach/engineering-highschool-summer-camps",
    "https://engineering.wayne.edu/academics/community/outreach/summer-academy"
  ]
}
