{
  "apply_url": null,
  "verified": "fetched",
  "verified_on": "2026-10-09",
  "grades": "6 to 12",
  "min_age": null,
  "max_age": null,
  "id": "champaign-urbana-park-district-fresh-crew",
  "name": "FRESH Crew Teen Volunteer Days",
  "org": "Urbana Park District",
  "regions": [
    "champaign"
  ],
  "city": "Urbana, IL",
  "type": "volunteer",
  "fields": [
    "environment"
  ],
  "what_you_do": "Join Saturday stewardship days in local parks: collect prairie seed, pull invasive plants and clear trash. No experience needed.",
  "who_can_apply": "Teens in grades 6 to 12. A parent or guardian must complete the Volunteer Waiver first.",
  "paid_type": "unpaid",
  "pay_detail": "Unpaid. You can earn service hours and references.",
  "season": "fall",
  "duration": "2 hours per event (2 to 4 pm Saturdays)",
  "status": "unconfirmed",
  "deadline_text": "No registration. Fall 2026 dates: Oct 3, Oct 17, Nov 7, Nov 21, Dec 5 (2 to 4 pm).",
  "deadline_iso": null,
  "deadline_confidence": "unknown",
  "how_to_apply": "Show up. A guardian signs the Volunteer Waiver and emails it to Connor Ross (cjross@urbanaparks.org, 217-384-4062) or brings a printed copy on the day.",
  "needs_work_permit": false,
  "url": "https://www.urbanaparks.org/teen-programs#fresh-crew",
  "sources_fetched": [
    "https://www.urbanaparks.org/teen-programs",
    "https://www.urbanaparks.org/news/teens-can-make-new-friends--learn-new-skills--and-make-parks-beautiful-this-fall-"
  ],
  "priority": 2,
  "notes": "Meets about every two weeks at different parks (Victory, Meadowbrook, Weaver, Crystal Lake, Busey Woods). The same page lists a free Teen Hangout Zone for grades 6 to 12 on select Fridays at Phillips Recreation Center."
}
