{
  "id": "alameda-free-library-teen-advisory-group",
  "name": "Alameda Free Library Teen Advisory Group (TAG)",
  "org": "Alameda Free Library",
  "regions": [
    "alameda"
  ],
  "city": "Alameda, CA (Main Library, Stafford Room)",
  "type": "leadership",
  "fields": [
    "education",
    "arts-media"
  ],
  "what_you_do": "You suggest ideas for library events and projects. You earn 1 service hour per meeting.",
  "min_age": null,
  "max_age": null,
  "grades": null,
  "who_can_apply": "Teens. The TAG page does not state an age or grade. Other teen volunteer roles on the same page use grades 7 to 12 or ages 12 to 17.",
  "paid_type": "unpaid",
  "pay_detail": "Community service hours only",
  "season": "school-year",
  "duration": "1st Tuesday of the month, 4:30 to 5:30 pm",
  "status": "unconfirmed",
  "opens_iso": null,
  "deadline_text": "The page states no deadline or intake dates.",
  "deadline_iso": null,
  "deadline_confidence": "unknown",
  "how_to_apply": "Complete the online TAG registration form on the library page. Questions: refdesk@alamedaca.gov or (510) 747-7777.",
  "needs_work_permit": false,
  "url": "https://www.alamedafree.org/Teen-Services/Teen-Volunteer-Information",
  "apply_url": null,
  "sources_fetched": [
    "https://www.alamedafree.org/Teen-Services/Teen-Volunteer-Information",
    "https://www.alamedafree.org/PROGRAMS-SERVICES/Teen-Services/Teen-Volunteer-Information"
  ],
  "verified": "fetched",
  "verified_on": "2026-10-07",
  "priority": 3,
  "notes": "Meets at the Main Library in the Stafford Room. The page states no age rule, so ask the library if you are younger than 12 or older than 17. See also Alameda Free Library Teen Volunteers (Book Reviewers and Coding with LEGO) for volunteer roles such as book reviews and LEGO coding."
}
