{
  "id": "pennsylvania-civil-air-patrol-cadets",
  "name": "Civil Air Patrol Cadet Program, Pennsylvania Wing",
  "org": "Civil Air Patrol, Pennsylvania Wing",
  "regions": [
    "pennsylvania"
  ],
  "city": "Pennsylvania (local squadrons across the state)",
  "type": "leadership",
  "fields": [
    "engineering",
    "law-government"
  ],
  "what_you_do": "Join a local squadron for weekly meetings. Learn leadership, aerospace, fitness and character. Wear a uniform. Move up in rank as you take on more leadership.",
  "min_age": 12,
  "max_age": 18,
  "grades": null,
  "who_can_apply": "Be at least 12 and not yet 19. Be a U.S. citizen or a lawful permanent resident (National Headquarters can waive this for some lawfully admitted noncitizens). Attend at least three squadron meetings.",
  "paid_type": "fee-based",
  "pay_detail": "Annual dues of $25 to $50 depending on location. Uniform and overnight activity fees are extra. National Headquarters says a fully active cadet may spend $300 to $600 in the first year. Some help is available.",
  "season": "year-round",
  "duration": "Ongoing. Weekly 2-hour meetings, about one Saturday event a month and a week-long summer encampment (typical, per national page)",
  "status": "year-round",
  "opens_iso": null,
  "deadline_text": "No deadline. Join any time by visiting a squadron.",
  "deadline_iso": null,
  "deadline_confidence": "rolling",
  "how_to_apply": "Find a squadron with the unit locator. Visit a meeting with your parents. Go to at least three weekly meetings. Then fill out the application. You can also ask the squadron about the online application.",
  "needs_work_permit": false,
  "url": "https://pawg.cap.gov/join-pa001/become-a-cadet-ages-12-18/",
  "apply_url": null,
  "sources_fetched": [
    "https://pawg.cap.gov/",
    "https://pawg.cap.gov/join-pa001/become-a-cadet-ages-12-18/",
    "https://www.gocivilairpatrol.com/programs/cadets/"
  ],
  "verified": "fetched",
  "verified_on": "2026-10-09",
  "priority": 2,
  "notes": "No military duty. Cadets can stay in until age 21 and can switch to adult membership at 18. Squadron meetings and costs vary, so ask the squadron near you."
}
