{
  "grades": "10-12",
  "opens_iso": null,
  "deadline_iso": null,
  "apply_url": null,
  "needs_work_permit": null,
  "verified": "fetched",
  "verified_on": "2026-10-09",
  "priority": 1,
  "notes": "Dates above are from the 2026 flyer; check the page in March for 2027. Contact: 703-228-3329.",
  "id": "arlington-parks-arlingteens-leaders-summer-internship",
  "name": "Arlingteens Leaders Summer Internship",
  "org": "Arlington County Parks and Recreation",
  "regions": [
    "fairfax"
  ],
  "city": "Arlington, VA",
  "type": "internship",
  "fields": [
    "environment",
    "education",
    "any"
  ],
  "what_you_do": "Spend two weeks with Parks and Recreation staff. You try jobs like park ranger, nature guide, event planner, carpenter and preschool teacher.",
  "min_age": 14,
  "max_age": 18,
  "who_can_apply": "Teens ages 14 to 18 entering grades 10 to 12. Must be an Arlington resident.",
  "paid_type": "not-stated",
  "pay_detail": "Pay not stated. Lunch is provided on the first and last day.",
  "season": "summer",
  "duration": "Two weeks (July 20 to 31 in 2026)",
  "status": "closed-expect-reopen",
  "deadline_text": "2026 cycle: applications opened early March and closed May 10, 2026. 2027 dates not posted yet.",
  "deadline_confidence": "last-year-pattern",
  "how_to_apply": "Apply online when applications open in early March. To find the form, search for the name Arlingteens Leaders on the arlingtonva.us site. Look for the one that says teens.",
  "url": "https://www.arlingtonva.us/Government/Departments/Parks-Recreation/Programs/Teens/Skills-Development/Internship-Program",
  "sources_fetched": [
    "https://www.arlingtonva.us/Government/Departments/Parks-Recreation/Programs/Teens/Skills-Development/Internship-Program",
    "https://www.arlingtonva.us/files/sharedassets/public/v/1/parks-recreation/documents/temp/2026/arlingteens-leaders_2026.pdf"
  ]
}
