{
  "regions": [
    "los-angeles"
  ],
  "apply_url": "https://forms.office.com/Pages/ResponsePage.aspx?id=EVMR5cP2G0K8A6XYx5v1Rn7l2V-nZmJIpeHd5rBoiuhURUgyUk8zU1dGOFI1SVUyS0pXS1NPTllNRC4u",
  "verified": "fetched",
  "verified_on": "2026-10-10",
  "grades": null,
  "needs_work_permit": null,
  "id": "glendale-youth-alliance-step",
  "name": "Glendale Youth Alliance STEP (Student Training and Employment Program)",
  "type": "paid-youth-program",
  "fields": [
    "any"
  ],
  "what_you_do": "Get work training at Glendale Community College's Professional Development Center. Then do 120 hours of paid work at a worksite. The site is picked to match your skills and interests.",
  "min_age": 16,
  "max_age": 21,
  "who_can_apply": "Ages 16 to 21 and in school. You have a disability or health condition, such as an IEP, 504 plan, ADHD or anxiety.",
  "paid_type": "paid",
  "pay_detail": "Paid work experience. The hourly rate is not listed.",
  "season": "year-round",
  "duration": "120 hours",
  "status": "rolling",
  "opens_iso": null,
  "deadline_text": "No deadline stated. The page says to apply today through the one Apply Now form and a case worker contacts you in 3 to 5 business days. No application window is given.",
  "deadline_iso": null,
  "deadline_confidence": "rolling",
  "how_to_apply": "One online Apply Now form covers all GYA programs. A case worker contacts you in 3 to 5 business days. STEP contacts: (818) 937-8005 or (818) 937-8057.",
  "priority": 2,
  "notes": "The GYA page does not mention work permits or income rules.",
  "org": "Glendale Youth Alliance",
  "city": "Glendale, CA",
  "url": "https://www.glendaleyouthalliance.com/programs-1#:~:text=STEP%20%2D%20Student",
  "sources_fetched": [
    "https://www.glendaleyouthalliance.com/",
    "https://www.glendaleyouthalliance.com/programs-1"
  ]
}
